{
  "hardKeywords": [
    {
      "term": "Python",
      "category": "languages",
      "matched": "Python",
      "confidence": 1,
      "frequency": 1,
      "mustHave": false,
      "context": "…Senior Engineer with 5 years experience in AWS and Python."
    },
    {
      "term": "Amazon Web Services",
      "category": "cloud",
      "matched": "AWS",
      "confidence": 1,
      "frequency": 1,
      "mustHave": false,
      "context": "…hiring a Senior Engineer with 5 years experience in AWS and Python."
    }
  ],
  "softKeywords": [
    {
      "term": "Team Building",
      "matched": "hiring",
      "confidence": 0.9,
      "frequency": 1,
      "mustHave": false,
      "context": "# Unknown Role\n\nTest JD: We are hiring a Senior Engineer with 5 years experience in AWS…"
    }
  ],
  "senioritySignals": {
    "yearsMinimum": 5,
    "yearsPreferred": 0,
    "level": "senior",
    "signals": [
      {
        "type": "years_explicit",
        "value": "5"
      },
      {
        "type": "title_keyword",
        "value": "senior"
      }
    ],
    "title": "Unknown Role"
  },
  "metadata": {
    "extractedAt": "2026-06-30T02:57:34.123Z",
    "taxonomyVersion": "1.0.0",
    "jdSource": "text",
    "jdWordCount": 19,
    "processingTimeMs": 12,
    "extractorVersion": "1.0.0"
  }
}